{"$schema":"http://json-schema.org/draft-07/schema#","properties":{"admissible_classes":{"items":{"type":"string"},"type":"array"},"authority_rule":{"type":"string"},"family_logic":{"type":"string"},"frozen":{"type":"boolean"},"run_id":{"type":"string"},"version":{"type":"string"}},"required":["run_id","frozen","admissible_classes","authority_rule","family_logic"],"title":"refactoring_policy","type":"object"}
