{"admissible_classes":["representation-value rename","history reorder","action reorder","irrelevant metadata change","equivalent identifier rename","boundary-changing delegation-scope alternative"],"authority_rule":"harmless rewrites preserve closure; boundary-changing alternatives route to PARTIAL","family_logic":"frozen class only; unlisted perturbations fail the audit gate","frozen":true,"run_id":"pctau-20260906-672227c","version":"1.0-phase2"}
